<?xml version="1.0" encoding="UTF-8" standalone="no"?>
<!DOCTYPE template SYSTEM "template.dtd">

<template>
<askcontainer>1</askcontainer>
<description>New Sendmail Alias</description>
<icon>mail.png</icon>
<invalid>0</invalid>
<rdn>sendmailMTACluster</rdn>
<!--<regexp>^ou=People,o=.*,</regexp>-->
<title>Sendmail: Alias</title>
<visible>1</visible>

<objectClasses>
<objectClass id="sendmailMTAAliasObject"></objectClass>
</objectClasses>

<attributes>
<attribute id="sendmailMTACluster">
	<display>Sendmail Cluster Name</display>
	<icon>ldap-default.png</icon>
	<order>1</order>
	<page>1</page>
</attribute>
<attribute id="sendmailMTAHost">
	<display>Sendmail Hostname</display>
	<hint>Leave Blank</hint>
	<order>2</order>
	<page>1</page>
</attribute>
<attribute id="sendmailMTAKey">
	<display>Email alias</display>
	<order>3</order>
	<page>1</page>
</attribute>
<attribute id="sendmailMTAAliasValue">
	<display>Recipient Addresses</display>
	<order>4</order>
	<page>1</page>
	<type>textarea</type>
</attribute>
<attribute id="sendmailMTAAliasGrouping">
	<hidden>1</hidden>
	<value>aliases</value>
</attribute>
</attributes>

</template>
