<?xml version="1.0" encoding="UTF-8" standalone="no"?>
<!DOCTYPE template SYSTEM "template.dtd">

<template>
<askcontainer>1</askcontainer>
<description>New Sendmail Cluster</description>
<icon>mail.png</icon>
<invalid>0</invalid>
<rdn>sendmailMTACluster</rdn>
<!--<regexp>^ou=People,o=.*,</regexp>-->
<title>Sendmail: Cluster</title>
<visible>1</visible>

<objectClasses>
<objectClass id="sendmailMTA"></objectClass>
</objectClasses>

<attributes>
<attribute id="sendmailMTACluster">
	<display>Alias To</display>
	<order>1</order>
	<page>1</page>
</attribute>
</attributes>

</template>
