<?xml version="1.0" encoding="UTF-8" standalone="no"?>
<!DOCTYPE template SYSTEM "template.dtd">

<template>
<askcontainer>1</askcontainer>
<description>New LDAP Alias</description>
<icon>ldap-alias.png</icon>
<invalid>0</invalid>
<rdn>uid</rdn>
<!--<regexp>^ou=People,o=.*,</regexp>-->
<title>Generic: LDAP Alias</title>
<visible>1</visible>

<objectClasses>
<objectClass id="alias"></objectClass>
<objectClass id="extensibleObject"></objectClass>
</objectClasses>

<attributes>
<attribute id="aliasedObjectName">
	<display>Alias To</display>
	<order>2</order>
	<page>1</page>
</attribute>
<attribute id="uid">
	<display>User ID</display>
	<order>1</order>
	<page>1</page>
</attribute>
</attributes>

</template>
