<?xml version="1.0" encoding="UTF-8" standalone="no"?>
<!DOCTYPE template SYSTEM "template.dtd">

<!--This template doesnt does not appear to be correct. If it is correct, or if
    you have modifications to make it correct, then let us know, and we'll
    update and enable it.-->

<template>
<askcontainer>1</askcontainer>
<description>New Sendmail Virtual User</description>
<icon>mail.png</icon>
<invalid>1</invalid>
<rdn>sendmailMTAMapObject</rdn>
<!--<regexp>^ou=People,o=.*,</regexp>-->
<title>Sendmail: Virtual Users</title>
<visible>1</visible>

<objectClasses>
<objectClass id="sendmailMTAMapObject"></objectClass>
</objectClasses>

<attributes>
<attribute id="sendmailMTACluster">
	<display>Sendmail Cluster Name</display>
	<icon>ldap-default.png</icon>
	<order>1</order>
	<page>1</page>
</attribute>
<attribute id="sendmailMTAHost">
	<display>Sendmail Hostname</display>
	<hint>Leave Blank</hint>
	<order>2</order>
	<page>1</page>
</attribute>
<attribute id="sendmailMTAKey">
	<display>Email alias</display>
	<hint>use @example.com to map entire domain</hint>
	<order>3</order>
	<page>1</page>
</attribute>
<attribute id="sendmailMTAMapValue">
	<display>Recipient Addresses</display>
	<hint>use %1 to map user name port of address</hint>
	<order>4</order>
	<page>1</page>
	<type>textarea</type>
</attribute>
<attribute id="sendmailMTAMapName">
	<hidden>1</hidden>
	<value>virtuser</value>
</attribute>
</attributes>

</template>
