<?xml version="1.0" encoding="UTF-8" standalone="no"?>
<!DOCTYPE template SYSTEM "template.dtd">

<template>
<description>Address Book Entry</description>
<icon>address-book.png</icon>
<invalid>0</invalid>
<rdn>cn</rdn>
<noleaf>1</noleaf>
<!--<regexp>^ou=People,o=.*,</regexp>-->
<title>Generic: Address Book Entry</title>
<visible>0</visible>

<objectClasses>
<objectClass id="inetOrgPerson"></objectClass>
</objectClasses>

<attributes>
<attribute id="givenName">
	<display>First name</display>
	<icon>ldap-uid.png</icon>
	<onchange>=autoFill(cn;%givenName% %sn%)</onchange>
	<order>1</order>
</attribute>
<attribute id="sn">
	<display>Last name</display>
	<onchange>=autoFill(cn;%givenName% %sn%)</onchange>
	<order>2</order>
</attribute>
<attribute id="cn">
	<display>Common Name</display>
	<order>3</order>
	<readonly>1</readonly>
	<spacer>1</spacer>
</attribute>
<attribute id="jpegPhoto">
	<display>Photo</display>
	<order>3</order>
	<spacer>1</spacer>
</attribute>
<attribute id="o">
	<display>Organisation</display>
	<order>4</order>
</attribute>
<attribute id="street">
	<cols>50</cols>
	<display>Street</display>
	<icon>mail.png</icon>
	<order>5</order>
	<rows>4</rows>
	<type>textarea</type>
</attribute>
<attribute id="l">
	<display>City</display>
	<order>6</order>
</attribute>
<attribute id="st">
	<display>State</display>
	<order>7</order>
</attribute>
<attribute id="postalCode">
	<display>Postal code</display>
	<order>8</order>
	<spacer>1</spacer>
</attribute>
<attribute id="telephoneNumber">
	<display>Work phone</display>
	<icon>phone.png</icon>
	<order>9</order>
</attribute>
<attribute id="facsimileTelephoneNumber">
	<display>Fax</display>
	<order>10</order>
</attribute>
<attribute id="mobile">
	<display>Mobile</display>
	<order>11</order>
</attribute>
<attribute id="mail">
	<display>Email</display>
	<order>12</order>
</attribute>
</attributes>

</template>
