<?xml version="1.0" encoding="UTF-8" standalone="no"?>
<!DOCTYPE template SYSTEM "template.dtd">

<template>
<askcontainer>1</askcontainer>
<description>This is the description</description>
<icon>star.png</icon>
<invalid>1</invalid>
<rdn>o</rdn>
<regexp>^$</regexp>
<title>Example entry</title>
<visible>0</visible>

<objectClasses>
<objectClass id="organization"></objectClass>
</objectClasses>

<attributes>
<attribute id="attribute1">
	<display>Attribute 1</display>
	<hint>This is an example</hint>
	<icon>ldap-uid.png</icon>
	<order>1</order>
	<page>1</page>
</attribute>
<attribute id="attribute2">
	<display>Attribute 2</display>
	<order>2</order>
	<page>2</page>
</attribute>
<attribute id="attribute3">
	<display>Attribute 3</display>
	<order>1</order>
	<page>2</page>
</attribute>
</attributes>

</template>
