<?xml version="1.0" encoding="UTF-8" standalone="no"?>
<!DOCTYPE template SYSTEM "template.dtd">

<template>
<askcontainer>1</askcontainer>
<description>New Sendmail Domain</description>
<icon>mail.png</icon>
<invalid>0</invalid>
<rdn>sendmailMTACluster</rdn>
<!--<regexp>^ou=People,o=.*,</regexp>-->
<title>Sendmail: Domain</title>
<visible>1</visible>

<objectClasses>
<objectClass id="sendmailMTAClass"></objectClass>
</objectClasses>

<attributes>
<attribute id="sendmailMTACluster">
	<display>Sendmail Cluster Name</display>
	<icon>ldap-default.png</icon>
	<order>1</order>
	<page>1</page>
</attribute>
<attribute id="sendmailMTAHost">
	<display>Sendmail Hostname</display>
	<hint>Leave Blank</hint>
	<order>2</order>
	<page>1</page>
</attribute>
<attribute id="sendmailMTAClassValue">
	<display>Email domain</display>
	<order>3</order>
	<page>1</page>
</attribute>
<attribute id="sendmailMTAClassName">
	<hidden>1</hidden>
	<value>w</value>
</attribute>
</attributes>

</template>
